Nama Makanan / Minuman,Asin/Manis,Makanan/Minuman,Restoran,Harga,Lokasi (Gmaps),Alamat,Foto
Bakso Malang,Salty,Food,Pangsit Mie Bakso M Gendut - Lowokwaru,14290,https://maps.app.goo.gl/EHe1nLz1mZGdn4FJA,"Jl. Locari No.1, Lowokwaru, Kec. Lowokwaru, Kota Malang, Jawa Timur 65141",https://cdn.tasteatlas.com/images/dishrestaurants/a21232a6bbbf4c21a96c6ae009643345.jpg?w=600
Rawon Malang,Salty,Food,Rawon Pak Jenggot - Purwantoro,20000,https://maps.app.goo.gl/g37EDaUMZvaKoPdH6,"Jl. Sulfat No.5, Purwantoro, Kec. Blimbing, Kota Malang, Jawa Timur 65126",https://media.suara.com/pictures/653x366/2021/01/08/51998-ilustrasi-rawon-masakapahariinicom.jpg
Pecel Kawi,Salty,Food,Pecel Kawi Hj Musilah Asli 1975 - Klojen,17500,https://maps.app.goo.gl/PJva5axgM3KFGgQd9,"Jl. Kawi Kios No.43B, Bareng, Kec. Klojen, Kota Malang, Jawa Timur 65116",https://asset.kompas.com/crops/etxkCgz_0N5ZbdP6YGJScpobPVk=/60x23:959x622/750x500/data/photo/2020/11/05/5fa3f16d9c1cf.jpg
Orem-orem,Salty,Food,Rumadang Lontong Sayur dan Orem orem - Jatimulyo,16000,https://maps.app.goo.gl/UdnP8UZQVifgJ1AWA,"Ruko Taman Niaga, Jl. Soekarno Hatta, Jatimulyo, Kec. Lowokwaru, Kota Malang, Jawa Timur 65141",https://encrypted-tbn0.gstatic.com/images?q=tbn:ANd9GcR8XWf5Ml2j21T90Y0OvLr-sfPW8x6fZDtDiQ&s
Cwie Mie Malang,Salty,Food,Kedai Mie Sutoyo Malang - Lowokwaru,29700,https://maps.app.goo.gl/nVye4mL7PjhDNkcE9,"Jl. Letjen Sutoyo No.41A, Lowokwaru, Kec. Lowokwaru, Kota Malang, Jawa Timur 65141",https://img.kurio.network/I2NyzpMPKh_rPzrUVDfmk_DPaeA=/1200x1200/filters:quality(80)/https://kurio-img.kurioapps.com/21/11/06/abacc00c-2eaf-4ddc-a1ac-45e5df3f38f0.jpe
Bakso President,Salty,Food,Bakso President - Purwantoro,40000,https://maps.app.goo.gl/dYoDELG5fVcRwVs29,"Jl. Raya Cirendeu No.6, Ciputat, Kec. Ciputat Tim., Kota Tangerang Selatan, Banten 15419",https://pinhome.id/blog/wp-content/uploads/2021/07/menu-bakso-president-malang.jpg
Bakwan Malang,Salty,Food,Sego Srimben Bu Tjipto,17000,https://maps.app.goo.gl/Ha8nj2iJ5iTZbZZH7,"Jl. Raya Langsep No.33, Bareng, Kec. Klojen, Kota Malang, Jawa Timur 65146",https://assets-pergikuliner.com/6kpqTPngOOSxW5SNt_K8DooTSqo=/fit-in/1366x768/smart/filters:no_upscale()/https://assets-pergikuliner.com/uploads/bootsy/image/24777/Bakwan_Malang__pergikuliner.com_.jpg
Angsle,Sweet,Food,Angsle Ronde Akor - KSalty,13333,https://maps.app.goo.gl/6v4mXhQbWzCjgHtS8,"Jl. Sempu No.10, KSalty, Kec. Klojen, Kota Malang, Jawa Timur 65117",https://cdn0-production-images-kly.akamaized.net/Z1Eqk-9AqWgxreSE-epMYAMPICg=/1200x675/smart/filters:quality(75):strip_icc():format(jpeg)/kly-media-production/medias/3522443/original/019526800_1627369712-1.jpg
Mendol,Salty,Food,Rawon Pak Jenggot - Purwantoro,1700,https://maps.app.goo.gl/g37EDaUMZvaKoPdH6,"Jl. Sulfat No.5, Purwantoro, Kec. Blimbing, Kota Malang, Jawa Timur 65126",https://cdn0-production-images-kly.akamaized.net/IKkSQDVj7h5glZ327BbYge5axNs=/1x87:1000x650/469x260/filters:quality(75):strip_icc():format(webp)/kly-media-production/medias/4343107/original/079660300_1677721596-shutterstock_1866484465.jpg
Nasi Bhuk,Salty,Food,Nasi Bhuk Madura Pasar Jodipan,16182,https://maps.app.goo.gl/4SvAvjrJPAEqrNVG8,"Jl. Zaenal Zakse No.27, Jodipan, Kec. Blimbing, Kota Malang, Jawa Timur 65136",https://images.bisnis.com//upload/img/nasi%20bug%20matirah.jpg
Nasi Goreng Mawut,Salty,Food,Nasi Goreng Rri - Karang Besuki,18000,https://maps.app.goo.gl/5gdejmjBzYrHPq9P8,"Jl. Raya Candi II No.12, Karangbesuki, Kec. Sukun, Kota Malang, Jawa Timur 65146",https://foto.kontan.co.id/M25SCS1I114CHLIAKMXrvTLAnAI=/smart/filters:format(webp)/2023/11/23/1554832381p.jpg
Ronde Malang,Sweet,Food,Tahwa Ronde sahabat - Purwantoro,11000,https://maps.app.goo.gl/KfZkg43s7XgrYtud6,"Jl. Taman Sulfat No.74, Purwantoro, Kec. Blimbing, Kota Malang, Jawa Timur 65122",https://assets.promediateknologi.id/crop/0x0:0x0/750x500/webp/photo/2021/12/11/1252657206.jpg
Sego Resek,Salty,Food,Sego Resek - Sumbersari,16393,https://maps.app.goo.gl/xDjc9yV1vj4gPteN6,"Jl. Terusan Surabaya No.08, Sumbersari, Kec. Lowokwaru, Kota Malang, Jawa Timur 65115",https://static.promediateknologi.id/crop/0x0:0x0/0x0/webp/photo/indizone/2023/04/11/Z8s4rm8/nikmatnya-sego-resek-nasi-sampah-legendaris-yang-jadi-favorit-di-kota-malang73.jpg
Pecel Tumpang,Salty,Food,Pecel Tumpang Pak Sun - Bunulrejo,17000,https://maps.app.goo.gl/VdKgrfJDghcqu3wL8,"Jl. Hamid Rusdi No.10D, Bunulrejo, Kec. Blimbing, Kota Malang, Jawa Timur 65126",https://static.promediateknologi.id/crop/0x0:0x0/750x500/webp/photo/p2/78/2024/02/23/Desain-tanpa-judul64-917246707.png
Lontong Tahu,Salty,Food,Tahu Lontong Legendaris Bu Lis - Purwodadi,21500,https://maps.app.goo.gl/PP18KiTRhck49BBA9,"Jl. Kemirahan II C No.15, Purwodadi, Kec. Blimbing, Kota Malang, Jawa Timur 65125",https://asset-a.grid.id/crop/0x0:0x0/x/photo/2020/09/03/2597695570.jpg
Soto Daging,Salty,Food,Soto Daging Lamongan - Galunggung,20000,https://maps.app.goo.gl/GruM4xJb1MhEpkEa9,"Jl. Galunggung No.2, Gading Kasri, Kec. Klojen, Kota Malang, Jawa Timur 65146",https://asset.kompas.com/crops/2HB5yToRVrbwDTsZ6jWrRR7L4Co=/82x26:640x398/750x500/data/photo/2023/07/08/64a8d48019192.jpg
Sate Kelinci,Salty,Food,Sate Kelinci Kuda Karangploso,27000,https://maps.app.goo.gl/FH4BNNuvb87rTtHV8,"Jalan Raya Kepuharjo Pasar Wisata Kepuharjo Blok C19, Turi Rejo, Kepuharjo, Kec. Karang Ploso, Kabupaten Malang, Jawa Timur 65153",https://www.finnafood.com/blog/wp-content/uploads/2023/05/22.-Resep-Sate-Kelinci-Spesial-dengan-Sambal-Bawang.jpg
Es Pleret,Sweet,Food,Juragan bakso dan es pleret,9000,https://maps.app.goo.gl/CYSKMwN5t9Lenyhe9,"WJP4+563, Jalan Simpang, Golek, Pakisaji, Malang Regency, East Java 65162",https://www.tokomesin.com/wp-content/uploads/2015/07/es-pleret-tokomesin.jpg
Kripik Tempe,Salty,Food,Toko Oleh-oleh Lancar Jaya,9000,https://maps.app.goo.gl/tFRDfFizTRU8d1Uj9,"Jl. Tumenggung Suryo No.86, Purwantoro, Kec. Blimbing, Kota Malang, Jawa Timur 65126",https://assets.promediateknologi.id/crop/0x0:0x0/750x500/webp/photo/2022/01/05/3503512057.png
Kripik Ceker,Salty,Food,Toko Oleh-oleh Lancar Jaya,22500,https://maps.app.goo.gl/xpvtKgSJFQhiQUt19,"Jl. Tumenggung Suryo No.86, Purwantoro, Kec. Blimbing, Kota Malang, Jawa Timur 65126",https://i.imgur.com/D7PHHtO.jpeg
Kripik Tahu,Salty,Food,Toko Oleh-oleh Lancar Jaya,15000,https://maps.app.goo.gl/xpvtKgSJFQhiQUt19,"Jl. Tumenggung Suryo No.86, Purwantoro, Kec. Blimbing, Kota Malang, Jawa Timur 65126",https://i.imgur.com/lg9x3sM.jpeg
Nasi Bakar Cumi,Salty,Food,Sate Seafood Bakar Mbok Chand,24900,https://maps.app.goo.gl/2HLA7WUyLf5b2vmA8,Jln Bendungan Sutami 27a Rt 05 Rw 03 Kelurahan Sumbersari Kecamatan Lowokwaru,https://i.imgur.com/pAr7WqL.jpeg
Lapis Malang,Salty,Food,Lapis Malang - Lowokwaru,40000,https://maps.app.goo.gl/tXzxV548UyixHSgR8,"Jl. Soekarno Hatta No.30, Jatimulyo, Kec. Lowokwaru, Kota Malang, Jawa Timur 65141",https://i.imgur.com/e0U8XNw.jpeg
Lumpia Malang,Salty,Food,Lumpia Malang - Lowokwaru,7000,https://maps.app.goo.gl/EV8sPhdvucuwrRhm7,"Jl. Letjen Sutoyo No.85, Purwantoro, Kec. Lowokwaru, Kota Malang, Jawa Timur 65141",https://i.imgur.com/ozkCO50.jpeg
Es Tape Ketan Dawet,Sweet,Beverage,Es Cuping - Merjosari,16000,https://maps.app.goo.gl/r37eWG8doGM5y7VVA,"Jl. Joyo Utomo No.521B RT.4/RW.4, Merjosari, Lowokwaru, Malang, 65144",https://i.imgur.com/0iV0ov5.jpeg
Ceker Setan,Salty,Food,Ceker Setan - Gading Kasri,15000,https://maps.app.goo.gl/GMLj91xTGaS5eAZx6,"Jl. Pulosari No.15, Gading Kasri, Klojen, Malang, Malang, 65115",https://i.imgur.com/gdpBorP.jpeg
Rujak Sweet,Sweet,Food,Rujak Sweet Ananas Pak Bejo,50000,https://maps.app.goo.gl/PnV1Y3PCC7mLE5Q28,"Jl. Terusan Kawi No.9 Kav. 8, Bareng, Kec. Klojen, Kota Malang, Jawa Timur 65116",https://i.imgur.com/pP6rRRi.jpeg
Soto Kambing,Salty,Food,Soto Kambing Sam Yudi,35000,https://maps.app.goo.gl/A5MZGvdwrrfFY9hj6,"Jl. S. Supriadi Jl. S. Supriadi Gg. 4 No.110.112, Sukun, Kec. Sukun, Kota Malang, Jawa Timur 65147",https://i.imgur.com/SPIsHRw.jpeg
Mie Setan,Salty,Food,Mie Setan - Bromo,14900,https://maps.app.goo.gl/P4TDzzXHbcYCetPq7,"Jl. Bromo No. 1A, Klojen, Malang",https://i.imgur.com/seVC7rJ.jpeg
Keripik Jamur,Salty,Food,Keripik Tempe Rudi - Purwantoro,19000,https://maps.app.goo.gl/hfspsWZjE6Jk7evE9,"Jl. Sanan 7/34 Rt. 06/Rw. 16, Purwantoro, Blimbing, Malang, Malang, 65122",https://i.imgur.com/SfXEpIQ.jpeg
Es Dawet Ayu,Sweet,Food,Tahu Campur & Es Teler Durian Omama,22000,https://maps.app.goo.gl/XcoiN2SfyguSaCKBA,"Jl. Dokter Cipto Kios No. 1 & 2, Klojen, Malang",https://i.imgur.com/KnxXDM6.jpeg
Es Dawet Durian,Sweet,Beverage,Tahu Campur & Es Teler Durian Omama,30000,https://maps.app.goo.gl/XcoiN2SfyguSaCKBA,"Jl. Dokter Cipto Kios No. 1 & 2, Klojen, Malang",https://i.imgur.com/w808enE.jpeg
Gado-Gado Malang,Salty,Food,Gado-gado Pak Dji,33000,https://maps.app.goo.gl/iWr3qcAtNGzUUso4A,Jl. Hasanudin Dalam No. 31,https://i.imgur.com/AMASfzi.jpeg
Kue Putu,Sweet,Food,Puthu Lanang Malang,10000,https://maps.app.goo.gl/YB7phTjjJfphjxUV7,"Jl. Jaksa Agung Suprapto No.73, RT.03, Samaan, Kec. Klojen, Kota Malang, Jawa Timur 65112",https://i.imgur.com/agSw7oA.jpeg
Nasi Tiwul,Salty,Food,Warung Nasi Tiwul - Landungsari,5000,https://maps.app.goo.gl/6KprVUjCD2oVwKr78,"Jl. Tirto Sari No. A1, Dau, Malang",https://i.imgur.com/u0Fqd9m.jpeg
Keripik Menjes,Salty,Food,Keripik Tempe Sagu Bu Erna - Pandanwangi,19000,https://maps.app.goo.gl/dgvxzKyhYYSC4RLw5,"Jl. L.A. Sucipto Gg. 22A No.31 Rt 04 Rw 10, Pandanwangi, Blimbing, Malang, Malang, 65124",https://i.imgur.com/nhYzTgA.jpeg
Kue Terang Bulan,Sweet,Food,Terang Bulan dan Roti Bakar Primasari Sejak 2006,30000,https://maps.app.goo.gl/sWanPPvrLuauMVHn6,"Perum Imperial Cakalang Kav 1, Jl. Ikan Tombro Barat No. 296, Blimbing, Malang",https://i.imgur.com/gqo7CeE.jpeg
Pangsit Mie Ayam,Salty,Food,"Pangsit Mie Bromo Pojok, Patimura",28750,https://maps.app.goo.gl/hEAw3zLq8sM3nLWZ6,"Jl. Patimura No. 53, Klojen, Malang",https://i.imgur.com/g6If0Vc.jpeg
Mie Kober,Salty,Food,Kober Mie Bromo,14000,https://maps.app.goo.gl/6tScJdovuDGJXxyW6,"Jl. Bromo No.16b, Kauman, Kec. Klojen, Kota Malang, Jawa Timur 65119",https://i.imgur.com/VKeMVCi.jpeg
Bakso Bakar,Salty,Food,Bakso Bakar Trowulan,44000,https://maps.app.goo.gl/TEycJMUicTCtz9Zz7,"Jl. C.Trowulan No.65, Mojolangu, Kec. Lowokwaru, Kota Malang",https://i.imgur.com/czw2zw2.jpeg
Sempol Malang,Salty,Food,"Sempol Bang Jago, Bareng/ Klojen/ Malang",15000,https://maps.app.goo.gl/T1hzwoUcsPYWLXdQ7,Jl Terusan Ijen No 3 Malang,https://i.imgur.com/AHnUnqT.jpeg
Keripik Buah,Sweet,Food,Kripik Buah Malang,15000,https://maps.app.goo.gl/Apf6rpbNbTwSGHSW9,"Jl. Sanan Gg. III No.126, Purwantoro, Kec. Blimbing, Kota Malang",https://i.imgur.com/Gdnj93q.jpeg
Nasi Pecel Tumpang,Salty,Food,Pecel Tumpang Pak Sun - Tulusrejo,17000,https://maps.app.goo.gl/CsUVVVufkpVBduht7,"Jl. Hamid Rusdi No.10D, Bunulrejo, Kec. Blimbing, Kota Malang, Jawa Timur 65126",https://i.imgur.com/N07F1ua.jpeg
Onde-onde,Sweet,Food,Toko Kue Sara,9500,https://maps.app.goo.gl/444g5bSaY8z5VQTJ6,"Jl. Buring No.37, Oro-oro Dowo, Kec. Klojen, Kota Malang, Jawa Timur 65112",https://i.imgur.com/puiJC6J.jpeg
Nasi Goreng Samcan,Salty,Food,Bakwan & Mie Tidar,47500,https://maps.app.goo.gl/bRQH1YDmanM37mLWA,"Jl. Raya Tidar No.41a, Karangbesuki, Kec. Sukun, Kota Malang, Jawa Timur 65149",https://i.imgur.com/KD4uHh6.jpeg
Cwi Mi Samcan Goreng,Salty,Food,Bakwan & Mie Tidar,44000,https://maps.app.goo.gl/bRQH1YDmanM37mLWA,"Jl. Raya Tidar No.41a, Karangbesuki, Kec. Sukun, Kota Malang, Jawa Timur 65149",https://i.imgur.com/MJrJFEk.jpeg
Cenil,Sweet,Food,Ketan Lupis - Penanggungan,8000,https://maps.app.goo.gl/XbSJn9piFKJxVuYF9,"Jl. Mayjend Panjaitan XIII No.21, RT.4/RW.4, Penanggungan, Kec. Klojen, Kota Malang, Jawa Timur 65113",https://i.imgur.com/DtxWpud.jpeg
Klepon,Sweet,Food,Jajanan Pasar - Sitirejo,10000,https://maps.app.goo.gl/sduQnGshsXWYLvUv5,"Jl. Balai Desa No.44, RT.02/RW.03, Temu, Sitirejo, Kec. Wagir, Kabupaten Malang, Jawa Timur 65158",https://i.imgur.com/FjrvuiQ.jpeg
Wajik,Sweet,Food,Toko Kue Sara,8500,https://maps.app.goo.gl/hj3Xg2xFhS4DJjQ98,"Jl. Buring No.37, Oro-oro Dowo, Kec. Klojen, Kota Malang, Jawa Timur 65112",https://i.imgur.com/wqjPxDs.jpeg
Es Campur,Sweet,Food,Es Campur Bu Yuyun,10000,https://maps.app.goo.gl/ruTGsXn7h65JUzK27,"Bandungrejosari, Kec. Sukun, Kota Malang, Jawa Timur 65148",https://i.imgur.com/rQwENAY.jpeg
Lodeh Terong,Salty,Food,Urap Urap Malang,5000,https://maps.app.goo.gl/VTvKpypdmiPJ4zRd8,"Jl. Vinolia I, Jatimulyo, Kec. Lowokwaru",https://i.imgur.com/4nDADiH.jpeg
Urap-urap,Salty,Food,Dapur Rinjani - Oro-oro Dowo,19000,https://maps.app.goo.gl/M4NH7WCkbmfAJVN2A,"Jl. Rinjani No.15, Oro-oro Dowo, Kec. Klojen, Kota Malang, Jawa Timur 65119",https://i.imgur.com/cTBo02o.jpeg
Pisang Keju,Sweet,Food,pisang keju 99,12000,https://maps.app.goo.gl/1hxPAVcpmtr7Hdp86,"Jl. Gilimanuk No. 67A, Lowokwaru, Malang",https://i.imgur.com/2CeOoKi.jpeg
Nasi Lodeh Porong,Salty,Food,Depot Lodeh Porong,33750,https://maps.app.goo.gl/hMuSvjYQwnYCFGYH9,"Jl. Raya Porong No.55, Porong, Kec. Porong, Kabupaten Sidoarjo, Jawa Timur 61274",https://i.imgur.com/rWl4lT0.jpeg
Tahu Campur,Salty,Food,Tahu Campur Cak Uri Kumis,25000,https://maps.app.goo.gl/XKTFhmzsRw6eeBUr8,"Jl. Mayjen Hariyono Jl. MT. Haryono No.125, Dinoyo, Kec. Lowokwaru, Kota Malang",https://i.imgur.com/DEhWl6e.jpeg
Rujak Cingur,Salty,Food,"Rujak Cingur Warung Lani, Klojen Kota Malang",25000,https://maps.app.goo.gl/h9jdYedU7x7hAAJi7,"Jl. Husni Tamrin 7A/332, Klojen Kota Malang",https://www.nomadfoods.com/wp-content/uploads/2018/08/placeholder-1-e1533569576673.png
Gethuk Pisang,Sweet,Food,Gethuk Pisang Sahira,30000,https://maps.app.goo.gl/3znou7bfzzqCA8gV8,"Perum. Puri Indah Blok H2 No. 6A, Oro Oro Ombo, Batu",https://www.nomadfoods.com/wp-content/uploads/2018/08/placeholder-1-e1533569576673.png
Nasi Pecel Rawon,Salty,Food,Sate Soto Gule Krengsengan Tenes Pak Gendut,18000,https://maps.app.goo.gl/rgAf7odVP9qrdYo3A,"Jl. Zaenal Zakse 3 No.69, Kotalama, Kec. Kedungkandang, Kota Malang, Jawa Timur 65136",https://www.nomadfoods.com/wp-content/uploads/2018/08/placeholder-1-e1533569576673.png
Rujak Soto,Salty,Food,"Warung Rujak Soto Bu Agus Khas Banyuwangi, Bendulan 8D",17000,https://maps.app.goo.gl/4XEqZHqpEQ5GWg9e6,"Jl. Bendulan 8D, Sukun, Malang",https://www.nomadfoods.com/wp-content/uploads/2018/08/placeholder-1-e1533569576673.png
Tiwul Goreng,Salty,Food,Nasi Goreng Tiwul Leluhur Nusantara,13000,https://maps.app.goo.gl/taFTjcRsTekB1ZMr7,"Perumahan Green Karangduren Residence Gang 10 Blok BP 02, Pakisaji, Malang",https://www.nomadfoods.com/wp-content/uploads/2018/08/placeholder-1-e1533569576673.png
Sayur Asem Malang,Salty,Food,Ayam Penyet Ria,39000,https://maps.app.goo.gl/DTvSf4A27BywLGfk9,"Jl. HOS Cokroaminoto 22-A, Klojen, Malang",https://i.imgur.com/EhbeJ24.jpeg
Lemper Malang,Salty,Food,Toko Kue Bu Yanti,13000,https://maps.app.goo.gl/NHoZvo86s2KFtj2P9,"Pasar Singosari Blok D No. 2, Jl. Singosari Raya, Candirenggo",https://i.imgur.com/owFn29P.jpeg
Pisang Plenet,Sweet,Food,Restoran Pisang Planet,15000,https://maps.app.goo.gl/f99KQ9MvGQVFC92X8,"Perumahan Graha Mulia, Jl. Graha Mulia Raya, Lowokwaru, Malang",https://i.imgur.com/at6eKJS.png
Bubur Ayam Malang,Salty,Food,Bubur Ayam Abah Odil,25000,https://maps.app.goo.gl/urg5H1QnxgncTDTUA,"Ruko Griya Shanta Eksekutif, Jl. Soekarno Hatta Blok MP No. 48-49, Jatimulyo, Kec. Lowokwaru, Kota Malang",https://i.imgur.com/yct5DXU.jpeg
Ketan Kratok,Sweet,Food,Ketan Karito,7000,https://maps.app.goo.gl/U9anK66425NYnofk7,"Jl. Bantaran III B No.27, Tulusrejo, Kec. Lowokwaru, Kota Malang, Jawa Timur 65141",https://i.imgur.com/lJ3YMTX.jpeg
Nasi Resek,Salty,Food,Sego Goreng Resek (Pak Man),25000,https://maps.app.goo.gl/LFLtNpBhfHzxX7r98,"Jl. Brigjend. Katamso, KSalty, Kec. Klojen, Kota Malang, Jawa Timur",https://i.imgur.com/yoj5rxV.jpeg
Tahu Tek,Salty,Food,"Tahu Tek Pak Latief, Patimura",14000,https://maps.app.goo.gl/Egy4SY9bP3WvNH8s7,"Jl. Patimura No. 2a, Klojen, Malang",https://i.imgur.com/pj6PnDC.jpeg
Bubur Madura,Salty,Food,"Bu Mad (Bubur Madura) Samping SPBU Tidar, Puncak Yamin",9000,https://maps.app.goo.gl/kM6tiY6ZCKwDbwBr9,"Jl. Puncak Yamin (Samping SPBU), Sukun, Malang",https://i.imgur.com/M7lkbW5.jpeg
Wedang Ronde,Salty,Food,Warung Angsle Ronde,25000,https://maps.app.goo.gl/MSDXgpRa8E5KafN36,"Jl. Merbabu No.6, Oro-oro Dowo, Kec. Klojen, Kota Malang, Jawa Timur",https://i.imgur.com/8VGgfIz.jpeg
Cokelat Tempe,Sweet,Food,"Dekonco Coklat Tempe Oleh-Oleh Malang, Kedungkandang",9000,https://maps.app.goo.gl/VL3eLXAy3ugkYcfV6,"Jl. Danau Sentani Tengah No. H2-C10, Kedungkandang, Malang",https://i.imgur.com/Mn7muCI.jpeg
Pie Susu Telo Ungu,Sweet,Food,"Bakpao Telo, Karangploso",23000,https://maps.app.goo.gl/V3BNzw6L5k42tDeA9,"Cafe Sayur, Karangplodo, Girimoyo, Krc. Karang Ploso, Kabupaten Malang",https://i.imgur.com/iOtCEMl.jpeg
Mie Telo,Salty,Food,"Bakpao Telo, Karangploso",12000,https://maps.app.goo.gl/V3BNzw6L5k42tDeA9,"Cafe Sayur, Karangplodo, Girimoyo, Krc. Karang Ploso, Kabupaten Malang",https://i.imgur.com/wv2y4Dw.jpeg
Bakpao Telo,Sweet,Food,"Bakpao Telo, Karangploso",50000,https://maps.app.goo.gl/V3BNzw6L5k42tDeA9,"Cafe Sayur, Karangplodo, Girimoyo, Krc. Karang Ploso, Kabupaten Malang",https://i.imgur.com/jRlhnm7.jpeg
Bakso Goreng,Salty,Food,Baso Goreng Sekawan,25000,https://maps.app.goo.gl/b8ao6wzErYsWXKNv7,"Jl. Candi Mendut No.12, Mojolangu, Kec. Lowokwaru, Kota Malang, Jawa Timur 65142",https://i.imgur.com/xkwM44v.jpeg
Es Talun,Sweet,Beverage,"Depot Es Talun, Klojen",17000,https://maps.app.goo.gl/HZYLgnwLJr9MJVy78,"Jl. Kawi No. 1, Klojen, Malang",https://i.imgur.com/LUjoBy8.jpeg
Es Tawon Kidung Dalem,Sweet,Beverage,Es Tawon Kidul Dalem,8000,https://maps.app.goo.gl/dRhHbyPSvFt6m6te7,"Jl. K H Zainul Arifin, Gang Taqwa No. 1, Klojen, Malang",https://i.imgur.com/SIy7HSP.jpeg
Ronde Titoni,Sweet,Beverage,"Ronde Titoni, Tidar",24000,https://maps.app.goo.gl/mk6nR8HmmBRVF7ix7,"Jl. Esberg No. 3, Karangbesuki, Sukun, Malang",https://imgur.com/F1VSTKC.jpeg
Lodeh Tewel Pedas,Salty,Food,Pedesan Nyai - Gadingkasri,8600,https://maps.app.goo.gl/fn8g9BvnAmnxuXiD7,"Jl. Surabaya No.14, Gading Kasri, Kec. Klojen, Kota Malang, Jawa Timur 65115",https://i.imgur.com/9s2pL5G.jpeg
Es Santan 68,Sweet,Beverage,"Es Santan 68, Lowokwaru",7000,https://maps.app.goo.gl/kEWSEbew33ACpHQb8,"Jl. Puncak Borobudur No. 1, Lowokwaru, Malang",https://i.imgur.com/cBJXoe3.jpeg
Pisang Bolen Bengawan Solo,Sweet,Food,"Pisang Bolen Bengawan Solo, Mawar IV No. 8, Malang",60000,https://maps.app.goo.gl/fmWWm7fQtZJi7d8N9,"Jl. Mawar IV No.8, Lowokwaru, Kota Malang",https://i.imgur.com/lbNzutU.jpeg
Susu Telor Madu Jahe (STMJ),Sweet,Beverage,"STMJ Sukamadu, Kedungkandang",19000,https://maps.app.goo.gl/y1JRp6g5WzaKpib9A,"Jl. Terusan Sulfat No. 128 E, Kedungkandang, Malang",https://i.imgur.com/gOJM1lS.jpeg
Es Pisang Ijo,Sweet,Food,"Es pisang Ijo & Sop Buah, Kecamatan Klojen Kel.Samaan",10000,https://maps.app.goo.gl/jJj7r75aM2qGsdHa6,"Jl. Tapak Siring Gg. 1 No. 11 / 1528
",https://d1vbn70lmn1nqe.cloudfront.net/prod/wp-content/uploads/2023/07/24024706/Ini-Cara-Membuat-Es-Pisang-Ijo-Khas-Makassar-yang-Menyegarkan-.jpg
Es Kocok Alpukat,Sweet,Beverage,"Alpukat Kocok & Jus Gendut, Blimbing",16000,https://maps.app.goo.gl/qKTzqGp6zbSKXaZP8,"Jln Raya Titan Asri J7, Blimbing, Kota Malang",https://i0.wp.com/stiebp.ac.id/wp-content/uploads/2019/10/1571289873_Beverage-Kekinian-Murah-Alpukat-Kocok-Lagi-Hits.jpg?fit=1200%2C691&ssl=1
Es Kacang Ijo,Sweet,Beverage,"Es Kacang Ijo Jumbo DTC, Jaksa Agung Suprapto II",16000,https://maps.app.goo.gl/tpeKbBbCChiCN2eu6,"Jl. J.A. Suprapto II No.48 C, Rampal Celaket, Kec. Klojen, Kota Malang, Jawa Timur 65111",https://api.omela.com/storage/content-editor-images/k79rYuzPQfScmMfsrbM7rHbGCmKzzpvrGSdf5d5V.jpg
Wedang Jahe Kapulaga,Sweet,Beverage,"Wedang Jahe Kopulaga, Klojen, Gading Kasri,",17500,https://maps.app.goo.gl/iyY18aYgauRtUC9L8,"Jl. Probolinggo No.3, Gading Kasri, Kec. Klojen, Kota Malang, Jawa Timur 65115",https://cdns.klimg.com/merdeka.com/i/w/news/2017/09/20/888842/content_images/670x335/20170920111004-1-ilustrasi-wedang-kapulaga-001-tantri-setyorini.jpg
Nasi Kuning,Salty,Food,"Nasi Kuning Wilis, Museum Brawijaya",15000,https://maps.app.goo.gl/k3LMsXvPC2jYXddM7,"Jl. Wilis, Gading Kasri, Kec. Klojen, Kota Malang, Jawa Timur 65115",https://img.kurio.network/Gcwi1JA631V4oyGipdFfwrUP2GI=/1200x900/filters:quality(80)/https://kurio-img.kurioapps.com/21/08/12/b50aef91-a93b-40b2-93a0-1a081bf581fa.jpe
Spikoe Hana,Sweet,Food,"Pia Cap Mangkok, Semeru",85000,https://maps.app.goo.gl/JBTMAsEuXpyLbnAW9,"Jalan Semeru Nomor 25, Ruko Semeru, Klojen, Kauman, Kec. Klojen, Kota Malang, Jawa Timur 65111",https://images.tokopedia.net/img/cache/700/VqbcmM/2022/7/28/01a15b1f-44e1-4680-a311-16f332821504.jpg
Pia Cap Mangkok,Sweet,Food,"Pia Cap Mangkok, Semeru",26000,https://maps.app.goo.gl/JBTMAsEuXpyLbnAW9,"Jalan Semeru Nomor 25, Ruko Semeru, Klojen, Kauman, Kec. Klojen, Kota Malang, Jawa Timur 65111",https://images.tokopedia.net/img/cache/500-square/VqbcmM/2022/4/4/8cf51360-1946-4861-a192-2bbf7f8c6610.png
Tahwa (Wedang Tahu),Sweet,Food,"Tahwa Mas Agus, Klojen",10000,https://maps.app.goo.gl/A93iXBzDUKvmvjNGA,"Jl. Aries Munandar No.20, Kiduldalem, Kec. Klojen, Kota Malang, Jawa Timur 65119",https://asset.kompas.com/crops/sgS6iHzRJjt2l5GMjgtm8spQscM=/0x0:1000x667/750x500/data/photo/2020/08/22/5f412ff8eee87.jpg
Sego Tempong,Salty,Food,"Sego Tempong By Cak Uut, Klojen",41500,https://maps.app.goo.gl/MG8Asu9jvrN67x2R8,"Jl. Majapahit No.42, Kiduldalem, Kec. Klojen, Kota Malang, Jawa Timur 65119",https://cdn.rri.co.id/berita/1/images/1696727619769-s/uq4qxdl79novs8r.jpeg
Salad Buah MOI,Sweet,Food,Hola Jus #MOI Healthy Juice Buah Es Boost Potong 055 Mampang,17900,https://maps.app.goo.gl/UGqXGcTZaUHWBAjZ7,"Jl. Bunga Kumis Kucing No.47, Jatimulyo, Kec. Lowokwaru, Kota Malang, Jawa Timur 65141
",https://cdn.kmbmedia.id/uploads/2021/09/salad-moi-5.jpeg?resize=696%2C501&ssl=1
Strudel Apel Malang,Sweet,Food,"Strudel Asli Apel Malang, Klojen",46800,https://maps.app.goo.gl/4jfbvXMFNbSAP1Xy5,"Jl. K.H. Hasyim Ashari No.6B, Kauman, Kec. Klojen, Kota Malang, Jawa Timur 65119",https://i.gojekapi.com/darkroom/gofood-indonesia/v2/images/uploads/c35eadb4-0aa4-43d2-ba65-bdb8c8fb8cf4_menu-item-image_1711959761125.jpg
Mie Bakar Celaket,Salty,Food,"Mie Bakar Celaket, Jaksa Agung Suprapto",16000,https://maps.app.goo.gl/tiXEjHvsp4xaiTdV9,"Jl. Jaksa Agung Suprapto Gg. 1 No.22, Samaan, Kec. Klojen, Kota Malang, Jawa Timur 65111",https://assets.promediateknologi.id/crop/0x0:0x0/750x500/webp/photo/2022/12/12/69763968.jpg
Ketan Bubuk,Sweet,Food,"Stmj & Ketan Bubuk, Ksatrian Trusan , Blimbing",11000,https://maps.app.goo.gl/JkSLEsgyCFczX2DT7,"Jl. Terusan Kesatrian No.2, Kesatrian, Kec. Blimbing, Kota Malang, Jawa Timur 65121",https://asset.kompas.com/crops/wEmDQMgFse4PGMjBqUEjLsJqbjM=/100x67:900x600/750x500/data/photo/2022/06/17/62abc59c4b2ee.jpeg
Jenang Jowo Original,Sweet,Food,"De Jenangs (Es Jenang), Sukun",12500,https://maps.app.goo.gl/HVopDFEiJ9YySA6p7,"Jl. Kakak Tua Ut No.38, Sukun, Kec. Sukun, Kota Malang, Jawa Timur 65147",https://img.lazcdn.com/g/ff/kf/Sdbf17170fcc145acbc5540c29ded411d8.jpg_720x720q80.jpg
Jenang Londo,Sweet,Beverage,"De Jenangs (Es Jenang), Sukun",20000,https://maps.app.goo.gl/HVopDFEiJ9YySA6p7,"Jl. Kakak Tua Ut No.38, Sukun, Kec. Sukun, Kota Malang, Jawa Timur 65147",https://i.gojekapi.com/darkroom/gofood-indonesia/v2/images/uploads/a741f23b-b0bf-45ab-a409-cefdf151bd04_Go-Biz_20220516_115004.jpeg
Heci Ayam Khas Malang,Salty,Food,"Warung Steven by Heci Klenteng, Klojen, Kec.Klojen",18000,https://maps.app.goo.gl/L271wztZRdFEYEaa7,"Ruko Panglima Sudirman, Jl. Patimura No.60B Kav B, Klojen, Kec. Klojen, Kota Malang, Jawa Timur 65111","https://cdn.yummy.co.id/content-images/images/20230904/EVecmTaadgTvN5xM24rHneRsuC2dOFWx-31363933383132353034d41d8cd98f00b204e9800998ecf8427e.jpg?x-oss-process=image/resize,w_388,h_388,m_fixed,x-oss-process=image/format,webp"
Ubi Madu Asli Cilembu,Sweet,Food,"Restoran Ubi Madu Cilembu, Blimbing, Kota Malang",34000,https://maps.app.goo.gl/92NH8oUia4zJP8PB9,"Jl Sulfat 38, Purwantoro Blimbing Malang Jawa Timur",https://images.tokopedia.net/img/cache/500-square/VqbcmM/2022/9/22/8b14fc01-694c-48e9-9461-8fd289c24e1e.jpg
Donat Kentang Celaket,Sweet,Food,"Donat Kentang Celaket, Jaksa Agung Suprapto",30500,https://maps.app.goo.gl/miyKTWBgGmj5aS4U8,"Jl. Jaksa Agung Suprapto, Gang 1 No. 34, Rampal Celaket, Malang",https://i.gojekapi.com/darkroom/gofood-indonesia/v2/images/uploads/9f1248aa-2f28-463c-9c11-726d77938cd9_Go-Biz_20220808_114504.jpeg
Queen Apple,Sweet,Food,"Queen Apple, Kawi",65000,https://maps.app.goo.gl/5aUyYtWv9Z8LHNio8,"Jl. Kawi Atas No. 23, Gading Kasri, Klojen, Malang
",https://encrypted-tbn0.gstatic.com/images?q=tbn:ANd9GcSZH1ZkEP8-pQI6bFEzpJBbzANr33D4FiIkrQ&s
Lapis Kukus,Sweet,Food,"Lapis Kukus Tugu Malang, Mawar",42500,https://maps.app.goo.gl/yPUPtywnpDE7hpke6,"Mawar Gg. I/A No.11, Lowokwaru, Kec. Lowokwaru, Kota Malang, Jawa Timur 65141",https://paxelmarket.co/wp-content/uploads/2021/04/lapis-kukus-pahlawan-original.jpg
Fluffy Bread,Sweet,Food,"Keikpop by The Food Chain, Malang R. Suprapto",59000,https://maps.app.goo.gl/pNHm9Bz1qBrqF84A6,"Jl. Jaksa Agung Suprapto No. 52, Klojen, Malang",https://images.tokopedia.net/img/cache/700/VqbcmM/2021/11/22/c8d2cac1-0aa8-4a38-8c09-fc3b3d440e67.jpg
Sego Mawut,Salty,Food,Sego Goreng Jowo Khas Kediri,17000,https://maps.app.goo.gl/mSn4rVwVv9giwzT6A,"Jl. Sulfat, Purwantoro, Kec. Blimbing, Kota Malang, Jawa Timur",https://asset.kompas.com/crops/9JTuUKTwQZ5zg5yA2hwVsHb0ajE=/18x0:986x645/750x500/data/photo/2021/03/06/6042f87ebac6e.jpg
Soto Ayam Madura,Salty,Food,Warung Soto Madura,20000,https://maps.app.goo.gl/hvBu8YvLtNpoPE2L6,Jl. Lembang No. 131 Samaan Klojen Malang,https://asset.kompas.com/crops/uKBF7EnR2gcF4btwn_Iwlw9TZd4=/0x0:1000x667/750x500/data/photo/2020/07/20/5f15325e9dc87.jpg
